{
  "h2a_version": "0.1",
  "grant_id": "3f2a1c40-0d1e-4b2a-9c33-8a1b2c3d4e5f",
  "iss": "https://issuer.example.org/h2a/issuer",
  "subject_ref": "urn:h2a:subject:jane-actor-001",
  "grantee_ref": "urn:h2a:grantee:example-operator",
  "scope": {
    "purposes": ["promotional-video"],
    "media_types": ["video"],
    "territories": ["GB", "US"],
    "channels": ["social", "web"],
    "exclusions": ["political", "adult", "defamatory"]
  },
  "profiles": ["h2a-media"],
  "lease": { "cap": 500, "unit": "usd", "provider_agnostic": true, "nbf": "2026-07-16T00:00:00Z", "exp": "2026-10-16T00:00:00Z" },
  "status": {
    "uri": "https://issuer.example.org/h2a/status/2026-q3.json",
    "mirrors": ["https://cdn.example.net/h2a/status/2026-q3.json"],
    "index": 42
  },
  "revocation_horizon": "PT30M",
  "delegation": { "parent": null, "depth": 0, "effective_chain_horizon": "PT30M", "max_chain_horizon": "PT1H" },
  "alg": "ES256",
  "signatures": [
    { "role": "consent", "kid": "subject-key-1", "value": "BASE64URL_CONSENT_SIG" },
    { "role": "issuance", "kid": "issuer-key-1", "value": "BASE64URL_ISSUANCE_SIG" }
  ],
  "iat": "2026-07-16T00:00:00Z",
  "nbf": "2026-07-16T00:00:00Z",
  "exp": "2026-10-16T00:00:00Z"
}
